id,name,gender,size,ageText,ageCategory,tags,hasDisability,compatDogs,compatCats,compatKids,careLabel,bio,photoUrl,adoptionPage,source
kogoli,Kogoli,Male,Medium,1 year and 2 months,Young Adult,Youngster; Special Needs,True,maybe,maybe,maybe,Youngster · one-eyed,"Hit by a car as a tiny pup, Kogoli lost an eye and needed major treatment, but he’s bounced back as an energetic, playful boy who loves adventures around the shelter. He still deserves that first proper home of his own.",https://soidog.org/sites/default/files/styles/soidog_animal_slider/public/2025-11/2025-07-18SS_Kogoli-07_0.jpg?itok=uHbbTwLf,https://www.soidog.org/adopt/kogoli-336,Soi Dog Foundation
lamu,Lamu,Male,Medium,8 years and 3 months,Senior,Senior; Special Needs; Tripod,True,maybe,maybe,maybe,Senior tripod · shy at first,"Lamu grew up as a street dog and lost a hind leg in a traffic accident. He adapted brilliantly to life as a tripaw and loves zoomies and rolling in the grass, but he’s still a little cautious with new people and needs a calm, patient home.",https://soidog.org/sites/default/files/styles/soidog_animal_slider/public/2025-11/2021-07-07JE-Lamu-3_0.jpg?itok=_TjfQKXO,https://www.soidog.org/adopt/lamu-342,Soi Dog Foundation
karajan,Karajan,Female,Medium,4 years and 2 months,Adult,Small Dog; Unique,False,maybe,maybe,maybe,"Compact, independent girl","Karajan is a one-of-a-kind mix – think corgi legs with a long neck and classic Thai ridge. She’s curious and independent, happy to potter about and take everything in, and would suit people who appreciate a quirky, thoughtful companion.",https://soidog.org/sites/default/files/styles/soidog_animal_slider/public/2024-12/image%20%282%29_3.jpg?itok=rnPfQO8B,https://www.soidog.org/adopt/karajan-47,Soi Dog Foundation
moonlit,Moonlit,Male,Medium,3 years and 1 month,Young Adult,Special Needs; Tripod,True,maybe,maybe,maybe,Front-leg injury · confident,"Moonlit once roamed as an owned dog but lost part of his front leg in a snare trap. After surgery and rehab he’s become a confident, friendly and independent boy who still enjoys exploring – now he just needs a safe home base.",https://soidog.org/sites/default/files/styles/soidog_animal_slider/public/2025-09/2025.3.4NP-Moonlit-8_0.jpg?itok=vP3L9rNz,https://www.soidog.org/adopt/moonlit-305,Soi Dog Foundation
juju,Juju,Female,Medium,3 years and 5 months,Adult,Shy,False,maybe,maybe,maybe,Shy underdog,"Rescued at eight weeks old with a long list of illnesses and injuries, Juju took time to rebuild her confidence. She’s now a sweet, reserved and independent girl who blossoms slowly with people who move gently and let her set the pace.",https://soidog.org/sites/default/files/styles/soidog_animal_slider/public/2024-12/Juju-2_0.jpg?itok=TDhw4L3j,https://www.soidog.org/adopt/juju-38,Soi Dog Foundation
hilux,Hilux,Female,Medium,2 years and 4 months,Young Adult,Special Needs; Tripod,True,maybe,maybe,maybe,Young tripod · traffic accident survivor,"Hilux was around eight months old when she was hit by a vehicle and had to have a leg amputated. With help from the behaviour team she’s gone from frightened to much braver, but she’ll still do best with adopters who go slow and build trust.",https://soidog.org/sites/default/files/styles/soidog_animal_slider/public/2025-05/2024.10.2NP-Hilux-profile_0.jpg?itok=n82XXsI1,https://www.soidog.org/adopt/hilux-188,Soi Dog Foundation
